{
  "$schema": "https://json-schema.org/draft/2020-12/schema",
  "$id": "pantheon.contracts.v1.envelope",
  "type": "object",
  "required": [
    "event_name",
    "event_version",
    "operation_id",
    "occurred_at",
    "producer",
    "agent_id",
    "user_id",
    "generation",
    "payload"
  ],
  "properties": {
    "event_name": {
      "type": "string"
    },
    "event_version": {
      "type": "integer",
      "const": 1
    },
    "operation_id": {
      "type": "string",
      "format": "uuid"
    },
    "correlation_id": {
      "type": "string",
      "format": "uuid"
    },
    "causation_id": {
      "type": "string",
      "format": "uuid"
    },
    "occurred_at": {
      "type": "string",
      "format": "date-time"
    },
    "producer": {
      "type": "string",
      "minLength": 1
    },
    "agent_id": {
      "type": "string",
      "format": "uuid"
    },
    "user_id": {
      "type": "string",
      "format": "uuid"
    },
    "generation": {
      "type": "integer",
      "minimum": 1
    },
    "payload": {
      "type": "object"
    }
  },
  "additionalProperties": false
}
